QuestionID,RespTxt,RespPct,QuestionTxt,QuestionNote,SubPopulation,ReleaseDate,SurveyOrg,SurveySponsor,SourceDoc,BegDate,EndDate,ExactDates,SampleDesc,SampleSize,IntMethod,StudyNote 
"USPSRA.031517.R13J","Yes, law does this","50","(I'm going to read a list of specific elements or parts of the 2010 health care law. For each, please tell me whether you think it is something the law does, or not.) To the best of your knowledge, would you say the 2010 health care law does or does not...allow undocumented immigrants to receive financial help from the government to buy health insurance?","* = less than .5 percent","Asked of Form B half sample","03/15/2017","Princeton Survey Research Associates International","Henry J. Kaiser Family Foundation","Kaiser Health Tracking Poll","03/06/2017","03/12/2017","Y","national adult","1206","telephone","421 respondents were interviewed on a landline telephone, and 785 were interviewed on a cell phone, including 465 who had no landline telephone." 
"USPSRA.031517.R13J","No, law does not do this","39","(I'm going to read a list of specific elements or parts of the 2010 health care law. For each, please tell me whether you think it is something the law does, or not.) To the best of your knowledge, would you say the 2010 health care law does or does not...allow undocumented immigrants to receive financial help from the government to buy health insurance?","* = less than .5 percent","Asked of Form B half sample","03/15/2017","Princeton Survey Research Associates International","Henry J. Kaiser Family Foundation","Kaiser Health Tracking Poll","03/06/2017","03/12/2017","Y","national adult","1206","telephone","421 respondents were interviewed on a landline telephone, and 785 were interviewed on a cell phone, including 465 who had no landline telephone." 
"USPSRA.031517.R13J","Don't know","11","(I'm going to read a list of specific elements or parts of the 2010 health care law. For each, please tell me whether you think it is something the law does, or not.) To the best of your knowledge, would you say the 2010 health care law does or does not...allow undocumented immigrants to receive financial help from the government to buy health insurance?","* = less than .5 percent","Asked of Form B half sample","03/15/2017","Princeton Survey Research Associates International","Henry J. Kaiser Family Foundation","Kaiser Health Tracking Poll","03/06/2017","03/12/2017","Y","national adult","1206","telephone","421 respondents were interviewed on a landline telephone, and 785 were interviewed on a cell phone, including 465 who had no landline telephone." 
"USPSRA.031517.R13J","Refused","*","(I'm going to read a list of specific elements or parts of the 2010 health care law. For each, please tell me whether you think it is something the law does, or not.) To the best of your knowledge, would you say the 2010 health care law does or does not...allow undocumented immigrants to receive financial help from the government to buy health insurance?","* = less than .5 percent","Asked of Form B half sample","03/15/2017","Princeton Survey Research Associates International","Henry J. Kaiser Family Foundation","Kaiser Health Tracking Poll","03/06/2017","03/12/2017","Y","national adult","1206","telephone","421 respondents were interviewed on a landline telephone, and 785 were interviewed on a cell phone, including 465 who had no landline telephone." 
Number of items downloaded: 1